सविनय अवज्ञा आंदोलन का मुख्य कानूनी परिणाम क्या था?, भारतीय संविधान, भारत विभाजन, 1935 का भारत शासन अधिनियम, कर सुधार, c
चम्पारण के किसानों की मुख्य समस्या क्या थी?, ज़मींदारी प्रथा, नील की खेती का दबाव, कर वृद्धि, शिक्षा का अभाव, b
'तीनकठिया' व्यवस्था क्या थी?, किसानों की ज़मीन का तीन-भाग ले लेना , खेती का कर,अपने जमीन के 3/20 भाग पर नील की खेती करना, अंग्रेजों का व्यापार, c
महात्मा गांधी ने चम्पारण में किस वर्ष आंदोलन शुरू किया?, 1916, 1917, 1920, 1930, b
नील की खेती के प्रति किसानों की नकारात्मकता का मुख्य कारण क्या था?, अत्यधिक कर, ज़मीनी उर्वरता घटती थी, काम का अधिक बोझ, मजदूरी की कमी, b
महात्मा गांधी को चम्पारण बुलाने वाले नेता कौन थे?, राजकुमार शुक्ल, मोहनदास करमचंद, विनोबा भावे, बाल गंगाधर तिलक, a
चम्पारण एग्रेरीयन कमेटी का गठन किसके दबाव में किया गया?, स्थानीय नेताओं, महात्मा गांधी, सरकार, किसानों के प्रतिनिधियों, b
गांधीजी के सहयोगी कौन थे जिन्होंने चम्पारण सत्याग्रह में महत्वपूर्ण भूमिका अदा की?, केवल किसान, विदेशी व्यापारी, शिक्षित मध्यम वर्ग, स्थानीय मुख्तियारी, c
खेड़ा आंदोलन किस कारण शुरू हुआ था?, भूमि अधिग्रहण के लिए, लगान की माफी के लिए, कृषि सुधारों के लिए, शिक्षा के लिए, b
गाँधी जी ने खेड़ा में सत्याग्रह कब शुरू किया?, 10 अप्रैल 1916,22 जून 1918,17 मई 1920,9 नवंबर 1925, b
गांधीजी ने खेड़ा में सत्याग्रह समाप्त करने की घोषणा कब की?, 21 जून 1918, 22 जून 1918, 24 जुलाई 1918, 30 जुलाई 1918, c
मोपला विद्रोह किस क्षेत्र में हुआ?, मालाबार तट, गुजरात, महाराष्ट्र, कर्नाटका, a
मोपला विद्रोह में भाग लेने वाले किसानों का धर्म क्या था?, हिन्दू, इस्लाम, बौद्ध, सिख, b
मोपला विद्रोहियों ने किसे अपना राजा घोषित किया? ,अली मुसालियार, महात्मा गांधी, बल्लभ भाई पटेल, मुहम्मद अली जिन्ना, a
किस वर्ष में मोपला विद्रोह शुरू हुआ था? ,1915, 1918, 1917, 1920, c
मोपला विद्रोह में सरकार ने सैनिक कार्रवाई कब शुरू की?, अगस्त 1921, अक्टूबर 1921, दिसम्बर 1921, जनवरी 1922, b
बारदोली सत्याग्रह में किसने महत्वपूर्ण भूमिका निभाई?, महात्मा गांधी, सरदार बल्लभ भाई पटेल, जवाहरलाल नेहरू, सुभाष चंद्र बोस, b
बारदोली सत्याग्रह का कारण क्या था?, आर्थिक सुधार, लगान वृद्धि, लगान वृद्धि के खिलाफ असंतोष, भूमि सुधार, c
बारदोली सत्याग्रह कब शुरू हुआ?, जनवरी 1928, फरवरी 1928, मार्च 1928, मई 1928, b
मुंगेर में शाह मुहम्मद जूबैर के नेतृत्व में किसान सभा का गठन कब हुआ था? ,1920, 1925, 1922-23, 1928, c
मुंगेर के किसान सभा को किसने व्यापक एवं शक्तिशाली आधार 1928 ईस्वी में दिया ?,अली मुसालियार, महात्मा गांधी, बल्लभ भाई पटेल,सहजानंद सरस्वती,d
किस वर्ष 'अखिल भारतीय किसान सभा' का गठन हुआ? ,1932, 1934, 1936, 1938, c
किसान सभा के गठन का उद्देश्य क्या था?, मजदूरों के अधिकार, किसानों के अधिकार, औद्योगिक विकास, व्यापार को बढ़ावा देना, b
सरकार ने किस समिति के नेतृत्व में लगान की दर में कमी की?, ब्लूमफील्ड और मैक्सवेल, सरकार की जाँच समिति, किसान सभा, कोई नहीं, a
किस वर्ष में किसान सभा को अधिक व्यापक आधार प्राप्त हुआ? ,1922, 1924, 1928, 1929, c
बकास्त आंदोलन किसने आरंभ किया?, महात्मा गांधी, स्वामी सहजानन्द सरस्वती, शाह मुहम्मद जुबैर, सरदार पटेल, b
किस साल में कांग्रेस ने किसानों की समस्याओं को प्रमुख मांग के रूप में स्वीकार किया?, 1935, 1937, 1936, 1938, b
किस वर्ष 'ऑल इंडिया ट्रेड यूनियन कांग्रेस' की स्थापना हुई थी? ,1919, 1921, 1920, 1930, c
किस नेता ने किसानों एवं श्रमिकों को राष्ट्रीय आन्दोलन में शामिल करने का सुझाव दिया?, महात्मा गांधी, सी. आर. दास, सुभाष चंद्र बोस, जवाहरलाल नेहरू, b
1917 की रूसी क्रांति का क्या प्रभाव पड़ा?, मजदूरों में असंतोष, कम्युनिस्ट विचारों का प्रसार, बोनस की वृद्धि, सभी विकल्प सही हैं, b
सविनय अवज्ञा आन्दोलन कब प्रारम्भ हुआ?, 1929, 1931, 1930, 1932, c
1929 'मेरठ षड़यंत्र' के नाम पर किसके विरुद्ध मुकदमा चलाया गया? ,महात्मा गांधी, सी. आर. दास, वामपंथी नेताओं, श्रमिकों, c
1931 में ऑल इंडिया ट्रेड यूनियन कांग्रेस में क्या हुआ? ,एकता, विभाजन, वृद्धि, समाप्ति, b
किस क्षेत्र में 1916 ई. में विद्रोह हुआ था?, गुजरात, उत्तर प्रदेश, पंजाब, गोदावरी पहाड़ियाँ ,d 
सीताराम राजू को कब गिरफ्तार किया गया? ,1923, 1924, 1925, 1926, b
किस प्रदेश में खोंड विद्रोह हुआ?, उड़ीसा, झारखंड, मध्य प्रदेश, बिहार, a
जतरा भगत का आंदोलन किस प्रकार का था? ,सशस्त्र, अहिंसक, धार्मिक, राजनीतिक, b
किस वर्ष से 1920 तक जतरा भगत का आंदोलन चला?, 1910, 1912, 1914, 1918, c
1917 मयूरभंज में किसने विद्रोह किया? ,आदिवासी, संथाल, कुकी, मणिपुर, b
किस प्रथा के तहत आदिवासियों को अधिकारियों का सामान उठाने के लिए बाध्य किया जाता था?,पूरक, पोथांग, धनुष, झूम, b
अखिल भारतीय राष्ट्रीय कांग्रेस का पहले नाम क्या था? ,लैंड होल्डर्स सोसाइटी, बंगाल ब्रिटिश इंडियन एसोसिएशन, इंडियन एसोसिएशन, भारतीय राष्ट्रीय संघ, c
दिसम्बर 1883 में कौन सा संगठन सम्मेलन बुलाया गया?, पूना सार्वजनिक सभा, नेशनल कांफ्रेंस, मद्रास महाजन सभा, लैंड होल्डर्स सोसाइटी, b
भारतीय राष्ट्रीय कांग्रेस का नाम कब रखा गया ?, 25 दिसंबर 1885, 15 अगस्त 1947, 2 अक्टूबर 1905, 28 दिसंबर 1885, d
कांग्रेस का प्रारंभिक उद्देश्य क्या था? ,केवल विद्रोह, सुधार लाना, धार्मिक संघर्ष, विदेशी शासन का समर्थन, b
कांग्रेस ने ब्रिटिश शासन से मुक्ति में क्या भूमिका निभाई?, अप्रभावी, सर्वप्रमुख भूमिका, नकारात्मक, असहाय, b
वामपंथी शब्द का प्रथम प्रयोग कब हुआ था?, 20वीं शताब्दी, फ्रांसीसी क्रांति में, 18वीं शताब्दी, 19वीं शताब्दी, b
भारत में भारतीय कम्युनिस्ट पार्टी की स्थापना कब हुई थी? ,1917, 1920, 1930, 1925, b
किस वर्ष में AITUC का गठन हुआ?, 1925, 1920, 1930, 1926, b
अखिल भारतीय मजदूर किसान पार्टी की स्थापना कब हुई थी?, अक्टूबर 1934, दिसम्बर 1928, 1931, जनवरी 1930, b 
किस नेता ने 1931 में बिहार समाजवादी दल की स्थापना की थी?, राममनोहर लोहिया, जयप्रकाश बाबू, सुभाष चंद्र बोस,सर सैयद अहमद खां,b
सुभाष चंद्र बोस ने किस संगठन की स्थापना की?, समाजवादी दल, मजदूर किसान पार्टी, फारवर्ड ब्लॉक,कम्युनिस्ट,c
किसने 1877 में मोहम्मडन एंग्लो ओरिएन्टल कॉलेज स्थापित किया?,आगा खां, अब्दुल लतिफ, सर सैयद अहमद खां,जयप्रकाश बाबू,c 
मुस्लिम लीग की स्थापना कब हुई थी?,1905, 1906, 1911, 1910, b
स्वराज पार्टी की स्थापना कब हुई थी?, 1923, 1922, 1920, 1919, a
हिंदू महासभा की स्थापना कब हुई ?,1925,1915,1930,1940,b
हिंदू महासभा के संस्थापक कौन थे ?,महात्मा गांधी,पं. मदन मोहन मालवीय,सुभाष चंद्र बोस,डॉ. राजेंद्र प्रसाद,b
राष्ट्रीय स्वयंसेवक संघ की स्थापना किसने की ?,महात्मा गांधी,पं. नेहरू,के. बी. हेडगेवार,सुभाष चंद्र बोस,c
किस समय अवधि के बीच भारतीय राष्ट्रीय आंदोलन चरम पर था ?,1900 से 1914,1914 से 1930,1920 से 1947,1930 से 1940,b
राष्ट्रीय स्वयंसेवक संघ की स्थापना कब हुई?,1920,1922,1924,1925,d 