राष्ट्रवाद का शाब्दिक अर्थ क्या है?,राष्ट्रीय चेतना का उदय,समाज का विकास,भाषा का उत्थान,आर्थिक समृद्धि,a
19वीं शताब्दी में भारत में राष्ट्रवाद के उदय का मुख्य कारण क्या था?,अंग्रेजी शासन व्यवस्था,मुग़ल शासन,क्षेत्रीय संघर्ष,धार्मिक एकता,a
स्वतंत्रता संग्राम किसकी अभिव्यक्ति है?,राष्ट्रवाद,आर्थिक विकास,धार्मिक सुधार,सांस्कृतिक आदान-प्रदान,a
देश द्रोही सभा अधिनियम का उद्देश्य क्या था?,सभाओं पर रोक लगाना,प्रेस को बढ़ावा देना,वोटिंग अधिकार देना,शिक्षा नीति में सुधार,a
कलकत्ता कारपोरेशन एक्ट का प्रभाव क्या था?,गैर निर्वाचित सदस्यों की संख्या में वृद्धि,मंदिरों का निर्माण,शिक्षा नीति में सुधार,रोजगार में वृद्धि,a
आर्म्स एक्ट किस वर्ष में पारित हुआ था?,1907,1879,1910,1905,b
बंगाल विभाजन का निर्णय किस वर्ष में लिया गया?,1905,1911,1899,1878,a
अंग्रेजी शिक्षा नीति से भारतीयों ने क्या सीखा?,प्रजातंत्र और आधुनिक प्रगति,धार्मिक एकता,कृषि सुधार,औद्योगिक विकास,a
'देश द्रोही सभा अधिनियम' कब लागू किया गया?,1911,1910,1899,1907,d
वर्नाक्युलर एक्ट का उद्देश्य क्या था?,प्रेस पर प्रतिबंध लगाना,भारतीयों को शस्त्र रखने की अनुमति,भारतीय शिक्षा का प्रचार,नगरपालिका में सुधार,a
विश्वविद्यालय अधिनियम कब पारित हुआ?,1904,1910,1905,1899,a
वर्नाक्युलर एक्ट किस वर्ष में पारित हुआ था?,1878,1883,1904,1911,a
बंगाल विभाजन कब रद्द किया गया?,1911,1904,1905,1899,a
भारत में राष्ट्रवाद के उदय का मुख्य कारण क्या था?,ब्रिटिश प्रशासनिक नीतियाँ,धार्मिक एकता,भाषाई विविधता,भारतीय संस्कृति का उत्थान,a
डलहौजी की संरचनात्मक योजना के तहत किसका विकास हुआ?,रेलवे और टेलीग्राफ,शिक्षा प्रणाली,सैनिक प्रशिक्षण,कृषि नीति,a
कलकत्ता कारपोरेशन एक्ट किस वर्ष में पारित किया गया था?,1899,1878,1883,1905,a
इलबर्ट बिल का प्रस्तावित वर्ष कौन सा था?,1883,1899,1878,1904,a
इंडियन प्रेस एक्ट किस वर्ष में पारित हुआ था?,1910,1905,1907,1911,a
आर्म्स एक्ट के तहत भारतीयों के लिए क्या प्रतिबंधित किया गया था?,अस्त्र-शस्त्र रखना,शिक्षा प्राप्त करना,सामूहिक सभा करना,यात्रा करना,a
साल 1882 में भारतीय सूती वस्त्रों पर से कौन सा कर हटाया गया था?, आयात कर, निर्यात कर, बिक्री कर, सेवा कर, a
किस फसल के उत्पादन से किसान विशेष रूप से पीड़ित थे?, गेहूँ, चावल, कपास और नील, सब्जियाँ, c
स्थायी बंदोबस्त के अंतर्गत जमींदारों को क्या देना पड़ता था?, सरकार को निश्चित भू-राजस्व, किसानों को अनुदान, औद्योगिक कर, विदेशी व्यापार कर, a
सरकारी सेवाओं में अंग्रेजों की नीति क्या थी?,समान,उदार,सहयोगी,पक्षपातपूर्ण,d
इंडियन सिविल सर्विस की परीक्षा कहाँ आयोजित की जाती थी?,भारत,दक्षिण अफ्रीका,अमेरिका,इंग्लैंड,d
सुरेन्द्रनाथ बनर्जी के साथ सरकार ने किस प्रकार का वर्त्ताव किया?,सहयोग,सम्मान,अच्छा वर्त्ताव,पदच्यूत करने की कोशिश,d
धर्म सुधार आन्दोलन ने राष्ट्रवाद उत्पन्न करने में क्या भूमिका अदा की?,महत्वपूर्ण,कोई भूमिका नहीं,विपरीत भूमिका,थोड़ी भूमिका,a
किस सदी में धार्मिक कुरीतियों के खिलाफ आन्दोलन की शुरूआत हुई?,18वीं,19वीं,20वीं,21वीं,b
1885 में क्या गठित हुआ?,भारतीय राष्ट्रीय कांग्रेस,भारतीय स्वतंत्रता संग्राम,भारतीय धर्म सुधार समिति,भारतीय गणराज्य,a
1914 में क्या शुरू हुआ?,द्वितीय विश्वयुद्ध,प्रथम विश्वयुद्ध,भारत का विभाजन,स्वतंत्रता संग्राम,b
"राजा राम मोहन राय, स्वामी विवेकानन्द और ईश्वरचन्द विद्यासागर जैसे महापुरूषों ने किसके खिलाफ आन्दोलन शुरू किया?",धार्मिक कुरीतियाँ,अंग्रेजों,अन्य महापुरूषों,समाज के खिलाफ,a
किस विद्वान ने भारतीय धर्मग्रन्थों का अंग्रेजी में अनुवाद किया?,महादेव गोविन्द रानाडे,मैकाले,मैक्समूलर,सर्वपल्ली राधाकृष्णन,c
स्वामी विवेकानन्द का योगदान किस क्षेत्र में था?,राजनीति,शिक्षा,विज्ञान,धर्म सुधार,d
किस वर्ष भारत में आयात शुल्क लगाया गया था ताकि कपड़ा उद्योग को बढ़ावा मिल सके और उसका फायदा अंग्रेजों को मिल सके?,1914,1920,1916,1918,c
युद्ध के आरम्भ में तिलक और गांधी ने किसमें सहयोग दिया?,स्वराज आन्दोलन,ब्रिटिश सरकार के युद्ध प्रयासों,कांग्रस पार्टी,सत्याग्रह,b
किस वर्ष होमरूल लीग आन्दोलन की शुरुआत हुई?,1913,1915,1917,1919,b
गदर पार्टी की स्थापना कब हुई थी?,1912,1913,1914,1915,b
कांग्रेस के गरम और नरम दल कब एक हुए?,1915,1917,1918,1916,d
युद्ध के दौरान इंग्लैंड की अर्थव्यवस्था किस स्थिति में थी?,स्थिर,सुखद,सशक्त,संकट में,d
1919 के मांटेग्यू-चेम्सफोर्ड योजना में क्या बदलाव किया गया?,प्रांतीय विधायी परिषदों का आकार बढ़ाया गया,आर्थिक सुधार किए गए,सामाजिक सुधार किए गए,धार्मिक सुधार किए गए,a
किस आन्दोलन के रूप में प्रथम महायुद्ध का प्रत्यक्ष प्रभाव सामने आया?,स्वराज आन्दोलन,खिलाफत आन्दोलन,सत्याग्रह आन्दोलन,गांधीवादी आन्दोलन,b
किस वर्ष में लीग कांग्रेस समझौता हुआ था?,1914,1915,1916,1917,c
गांधीजी ने 1915 में किस स्थान पर साबरमती आश्रम की स्थापना की?,दिल्ली,कोलकाता,पुणे,अहमदाबाद,d
रौलेट एक्ट के विरोध में गांधीजी ने क्या शुरू किया?,हड़ताल,सत्याग्रह,दर्शन,विरोध प्रदर्शन,b
रौलेट एक्ट को कब पारित किया गया?,21 मार्च 1918,21 मार्च 1919,21 मार्च 1920,21 मार्च 1921,b
रौलेट एक्ट को किसकी अनुशंसा पर पारित किया गया?,कांग्रेस,गवर्नर जनरल,सिडनी रौलेट समिति,सरकारी आयोग,c
जालियाँवाला बाग हत्याकांड कब हुआ?,6 अप्रैल 1919,9 अप्रैल 1919,13 अप्रैल 1919,15 अप्रैल 1919,c
जालियाँवाला बाग में किसने गोलियां चलाईं?,सरकार,जनरल ओ डायर,महात्मा गांधी,कर्जन,b
जालियाँवाला बाग नरसंहार में कितने लोगों की हत्या हुई थी?,500,1000,1500,2000,b
जालियाँवाला बाग हत्याकांड के विरोध में किसने 'नाइट' की उपाधि त्यागी?,महात्मा गांधी,शंकरन नायर,रवींद्रनाथ टैगोर,बाल गंगाधर तिलक,c
जालियाँवाला बाग के बाद पंजाब में क्या लागू किया गया?,सामान्य कानून,आपातकाल,मार्शल लॉ,स्थानीय प्रशासन,c
गांधी जी ने किस उपाधि को त्याग दिया था?,महानायक,कैसर-ए-हिन्द,राय बहादुर,सर्वश्रेष्ठ,b
खिलाफत आन्दोलन कब प्रारंभ हुआ?,1917,1918,1920,1919,c
खिलाफत आन्दोलन का मुख्य उद्देश्य क्या था?,ब्रिटेन के खिलाफ विद्रोह,मुस्लिम शासन की स्थापना,स्वराज की प्राप्ति,खलीफा के अधिकारों की रक्षा,d
खिलाफत दिवस कब मनाया गया?,6 अप्रैल 1919,17 अक्टूबर 1919,26 जनवरी 1920,15 अगस्त 1947,b
असहयोग आन्दोलन में किस प्रकार के कार्यक्रम अपनाए गए थे?,सिर्फ विध्वंसात्मक,सिर्फ रचनात्मक,विध्वंसात्मक और रचनात्मक,कोई नहीं,c
असहयोग आन्दोलन की अवधि क्या थी?,1920-1922,1919-1921,1921-1923,1918-1920,a
असहयोग आन्दोलन कब प्रारंभ हुआ?,जनवरी 1922,जनवरी 1918,जनवरी 1919,जनवरी 1921,d
प्रिंस ऑफ वेल्स का स्वागत कब किया गया?,1 जनवरी 1921,17 नवम्बर 1921,12 फरवरी 1922,5 फरवरी 1922,b
चौरी-चौरा की घटना कब हुई?,12 फरवरी 1922,5 फरवरी 1922,1 जनवरी 1921,17 नवम्बर 1921,b
असहयोग आन्दोलन को कब स्थगित किया गया?,1 जनवरी 1921,17 नवम्बर 1921,12 फरवरी 1922,5 फरवरी 1922,c
असहयोग आन्दोलन के बाद गांधीजी को कितने साल की सजा दी गई?,7 साल,8 साल,5 साल,6 साल,d
सविनय अवज्ञा आन्दोलन कब छेड़ा गया?,1942,1930,1921,1922,b
साइमन कमीशन का गठन कब किया गया था?,1927,1928,1926,1930,a
साइमन कमीशन का अध्यक्ष कौन था?,लार्ड बिरकनहैड,सर जॉन साइमन,मोतीलाल नेहरू,लॉर्ड कर्जन,b
साइमन कमीशन का भारत में विरोध क्यों हुआ?,सभी सदस्य भारतीय थे,कोई भारतीय सदस्य नहीं था,स्वराज्य की माँग नहीं थी,इसमें धार्मिक आधार पर भेदभाव था,b
नेहरू रिपोर्ट के अनुसार भारत को क्या दर्जा देने की मांग की गई थी?,पूर्ण स्वराज,डोमिनियन स्टेट,रिपब्लिकन स्टेट,प्रिंसली स्टेट,b
साइमन कमीशन बम्बई कब पहुँचा?,4 फरवरी 1927,3 फरवरी 1928,5 फरवरी 1929,6 फरवरी 1930,b
कांग्रेस ने दिल्ली मैं सर्वदलीय सम्मेलन का आयोजन कब किया?,मार्च 1927,जनवरी 1928,फरवरी 1928,अप्रैल 1929,c
किस ब्रिटिश अधिकारी ने भारतीयों को संविधान निर्माण की चुनौती दी?,लॉर्ड कर्जन,लॉर्ड बिरकनहैड,लॉर्ड मिंटो,लॉर्ड रीडिंग,b
लाहौर अधिवेशन (1929) में कांग्रेस का अध्यक्ष कौन था?,महात्मा गांधी,सुभाषचन्द्र बोस,मोतीलाल नेहरू,जवाहरलाल नेहरू,d
पूर्ण स्वराज्य दिवस मनाने की घोषणा कब की गई?,26 जनवरी 1930,2 अक्टूबर 1930,31 दिसम्बर 1929,15 अगस्त 1947,a
अप्रैल 1930 में चटगांव में सरकारी शस्त्रागार पर हमले का नेतृत्व किसने किया?,भगत सिंह,बटुकेश्वर दत्त,सुभाषचन्द्र बोस,सूर्यसेन,d
कांग्रेस ने स्वतंत्रता की घोषणा का प्रस्ताव कहाँ पढ़ा?,हिमालय के पाद में,रावी नदी के तट पर,गंगा के तट पर,साबरमती आश्रम,b
कांग्रेस में वामपंथी विचारधारा का नेतृत्व किनके द्वारा किया गया?,महात्मा गांधी और नेहरू,सुभाषचन्द्र बोस और भगत सिंह,वल्लभभाई पटेल और मोतीलाल नेहरू,जवाहरलाल नेहरू और सुभाषचन्द्र बोस,d
सविनय अवज्ञा आन्दोलन की पृष्ठभूमि में कौन-सा महत्वपूर्ण क्रांतिकारी केस था?,बंगाल षड्यंत्र केस,अलीगढ़ केस,बिहार षड्यंत्र केस,मेरठ षड्यंत्र केस,d
31 दिसम्बर 1929 की मध्य रात्रि को तिरंगा झंडा कहाँ फहराया गया था?,दिल्ली में लाल किला,कैलाश पर्वत,रावी नदी के तट पर,अंडमान द्वीप,c
गांधीजी ने सविनय अवज्ञा आंदोलन की शुरुआत किस यात्रा से की?,दांडी यात्रा,भारत यात्रा,अहमदाबाद यात्रा,स्वराज यात्रा,a
दांडी यात्रा कितने दिनों में पूरी हुई थी?,22 दिन,24 दिन,20 दिन,15 दिन,b
सविनय अवज्ञा आंदोलन की शुरुआत किस तिथि को हुई?,12 मार्च 1930,6 अप्रैल 1930,5 अप्रैल 1930,31 मार्च 1930,a
गांधीजी ने अपने कितने अनुयायियों के साथ दांडी यात्रा प्रारंभ की?,75 अनुयायी,80 अनुयायी,78 अनुयायी,50 अनुयायी,c
गांधीजी ने किस कानून का उल्लंघन कर सविनय अवज्ञा आंदोलन का आरंभ किया?,विदेशी कपड़ा कानून,नमक कानून,खादी कानून,शिक्षा कानून,b
गांधीजी ने आंदोलन प्रारंभ करने से पहले किसके सामने अपनी 11 सूत्रीय मांग रखी?,जवाहरलाल नेहरू,लॉर्ड इरविन,सर साइमन,लॉर्ड माउंटबेटन,b
गांधीजी ने किस तिथि को समुद्र के पानी से नमक बनाकर कानून तोड़ा?,5 अप्रैल 1930,10 अप्रैल 1930,1 मार्च 1930,6 अप्रैल 1930,d
तमिलनाडु में नमक यात्रा त्रिचनापल्ली से किस स्थान तक हुई?,कालीकट,धारासणा,पेशावर,वेदारण्य,d
मालाबार में किसने कालीकट से पोथान्नूर तक नमक यात्रा की?,खान अब्दुल गफ्फार खान,रानी गैडिनल्यू,के. केलप्पन,सरोजिनी नायडू,c
पेशावर में ‘खुदाई खिदमतगार’ का नेतृत्व किसने किया?,महात्मा गांधी,खान अब्दुल गफ्फार खान,के. केलप्पन,इमाम साहब,b
'खुदाई खिदमतगार' संगठन को और किस नाम से जाना जाता था?,नीली कुर्ती,हरी कुर्ती,लाल कुर्ती,सफेद कुर्ती,c
धरासणा में किसके नेतृत्व में आन्दोलन हुआ?,महात्मा गांधी,सरोजिनी नायडू,खान अब्दुल गफ्फार खान,रानी गैडिनल्यू,b
गुजरात के विभिन्न ताल्लुकों में किस प्रकार का आंदोलन प्रारंभ हुआ?,विद्रोह,कर बंदी,नमक कानून,शांति प्रदर्शन,b
असम में किसके विरोध में छात्रों ने आंदोलन चलाया?,कनिंघम सरकुलर,नमक कानून,जमींदारी प्रथा,गृह कर,a
मणिपुर एवं नगालैंड में किसने स्वतंत्रता आंदोलन का नेतृत्व किया?,सरोजिनी नायडू,रानी गैडिनल्यू,खान अब्दुल गफ्फार खान,इमाम साहब,b
बिहार में सिवान में चौकीदारी कर विरोधी आंदोलन का नेतृत्व किसने किया?,चन्द्रावती देवी,हसन इमाम,गंगा प्रसाद राय,विंध्यवासिनी देवी,c
विदेशी वस्त्रों के बहिष्कार में पटना की किस महिला ने नेतृत्व किया?,चन्द्रावती देवी,श्रीमती हसन इमाम,विंध्यवासिनी देवी,सुभाषिनी देवी,b
चौकीदारी कर विरोधी आंदोलन को गया में किसने चलाया?,चन्द्रावती देवी,हसन इमाम,गंगा प्रसाद राय,विंध्यवासिनी देवी,a
गांधी-इरविन पैक्ट को और किस नाम से जाना जाता है?,लखनऊ समझौता,दिल्ली समझौता,कलकत्ता समझौता,मुंबई समझौता,b
गांधी-इरविन पैक्ट कब हुआ?,5 मार्च 1931,9 अप्रैल 1928,10 मई 1932,2 जनवरी 1930,a
सविनय अवज्ञा आंदोलन का अंतिम समापन कब हुआ?,1933,1935,1934,1931,c
सविनय अवज्ञा आंदोलन के दौरान छपरा जेल के कैदियों ने किस प्रकार का विरोध किया?,चुप हड़ताल,भूख हड़ताल,नंगी हड़ताल,संगठित हड़ताल,c
सविनय अवज्ञा आंदोलन में महिलाओं की भूमिका का क्या विशेष महत्व था?,राजनीतिक भागीदारी,सार्वजनिक जीवन में प्रवेश,धार्मिक भूमिका,सामाजिक भूमिका,b
'वानर सेना' एवं 'मंजरी सेना' का गठन किस आंदोलन में हुआ?,असहयोग आंदोलन,सविनय अवज्ञा आंदोलन,भारत छोड़ो आंदोलन,स्वदेशी आंदोलन,b
सविनय अवज्ञा आंदोलन में किस आयोजन का संगठनात्मक महत्व था?,जुलूस,प्रभात फेरी,सभा,सभा,b
