असम वनस्पतिक क्षेत्र में किस प्रकार के वन होते हैं?,मैंग्रोव वन,पर्णपाती वन,साल के वृक्ष,बबूल,b
सिन्धु मैदान वनस्पतिक क्षेत्र में कौन से पौधे पाये जाते हैं?,चीर,साल,बांस,नागफनी,a
गंगा की मैदानी वनस्पतिक क्षेत्र में मुख्य रूप से क्या पाया जाता है?,खैर,साल,चीर,नागफनी,a
दक्षिण का पठारी वनस्पतिक क्षेत्र में क्या पाया जाता है?,सदाबहार वृक्ष,कोणधारी वृक्ष,झाड़ी,पतझड़ वाले वृक्ष,d
मालाबार वनस्पतिक क्षेत्र कहाँ स्थित है?,पूर्वी तटीय क्षेत्र,उत्तर भारत,पश्चिमी तटीय क्षेत्र,हिमालय क्षेत्र,c 
भारत में कितनी वाहिनी वनस्पति प्रजातियाँ देशी (Endemic) हैं?,35%,40%,30%,50%,a
भारत में कितनी मछलियों की प्रजातियाँ पाई जाती हैं?,1693,1800,240,2900,a
भारत में कितनी पक्षियों की प्रजातियाँ पाई जाती हैं?,1200,1500,1300,1400,a
भारत में कितनी स्तनपायी प्रजातियाँ पाई जाती हैं?,100,450,390,500,c
जैव विविधता का सबसे समृद्ध क्षेत्र कौन सा है?,पश्चिमी घाट,पूर्वी घाट,गंगा मैदान,अंडमान,b
भारत में जैव विविधता संरक्षण के लिए कितने जैवमंडल आरक्षित क्षेत्र स्थापित किए गए हैं?,15,12,14,10,c
भारत में चावल की कितनी किस्में पाई जाती हैं?,50000 से 60000,20000 से 25000,30000 से 35000,40000 से 50000,a
भारत में जैव विविधता का संरक्षण मुख्यतः किसके सहयोग से किया जा रहा है?,सार्क,संयुक्त राष्ट्र,वर्ल्ड बैंक,यूनेस्को,d
जैव विविधता का उपयोग किस उद्देश्य के लिए किया जाता है ?, केवल औषधीय उपयोग के लिए, केवल खाद्य उत्पादन के लिए, केवल पर्यावरण संरक्षण के लिए, उपरोक्त सभी, d
सबसे अधिक भोजन किससे उत्पन्न होता है ?, 20 से कम पौधों की प्रजातियों से, 100 पौधों की प्रजातियों से, 50 प्रकार के पशुओं से, 10 प्रकार के पौधों से, a
किस जंगली चावल से एशिया में धान की खेती को रोगों से सुरक्षा मिलती है ?, Oryza nivara, Oryza sativa, Oryza japonica, Oryza glaberrima, a
'जीवानी' औषधि किस पौधे के मिश्रण से तैयार की गई है ?,कानी आदिवासियों के पौधे,आरोग्यपाचा और तीन औषधीय पौधों,केरल के रबर के पौधों से,पेपर्मिंट और तुलसी से,b
क्यूनाईन (Quinine) किस पौधे से प्राप्त होता है ?, चिनचोना लेडजेनरियाना, पापाव्हर सोनीफेरम, टैक्सस बेक्केटा, सदाबहार वृक्ष, a
कौन सा पौधा तनाव रोधक गुण से भरपूर है ?, बबूल,नारियल,चाय,आरोग्यपाचा,d
'जीवानी' औषधि बनाने के लिए किस कंपनी को अधिकार दिया गया था ?, आर्यावैद्य फार्मेसी, हिमालया फार्मेसी, पतंजलि आयुर्वेद, वैद्यनाथ, a
'जीवानी' बनाने के लिए TBGRI ने कितना पंजियन शुल्क लिया था ?, 1 लाख, 2 लाख, 5 लाख, 10 लाख, d
लगभग कितनी प्रतिशत भैषज्य दवाईयाँ 120 पौधीय प्रजातियों से तैयार की जाती हैं ?, 20%, 25%, 30%, 50%, b
कौन सा औषधीय तत्व दर्द निवारक के रूप में उपयोग होता है ?,क्विनीन, टेक्सोल, पादप रेजिन,मार्फीन,d